repository_url,issue_number,title_processed,body_processed,label,label_cat,test_tag,valid,html_url,issue_reporter,issue_reporter_association,comment_count,commenters,comment_texts,commenter_associations
https://api.github.com/repos/SemBioProcess/SemGen,17,process participant multipliers need doubles not integers,data type process participant multipliers stoichiometries reaction double not int require code edits physical process java sem sim owlwriter sem sim owlreader least justification model creators integer stoichiometries reactions reason sbml supports double stoichiometries want able convert sbml models sem sim format process participant multipliers doubles,bug,bug,0,valid,https://github.com/SemBioProcess/SemGen/issues/17,maxneal,COLLABORATOR,4,"['thompsct', 'maxneal', 'thompsct', 'maxneal']","[""I've fixed this in the refactoring branch. Since I'm close to merging anyway, I'll bring them in with everything else."", 'If you are in the custom process editor and enter a double (as opposed to an integer) in the ""Multiplier"" field for a source, sink or mediator, you get an error message saying that it\'s an invalid entry.', ""Sorry, I hadn't committed it yet. Try it now."", 'Yep, works now. Thanks.']","['COLLABORATOR', 'COLLABORATOR', 'COLLABORATOR', 'COLLABORATOR']"
https://api.github.com/repos/MegaMek/megamek,273,marauder ii sprite facing incorrect camo not applied,trying work making movie weapons sound fx sprite marauder ii not facing correct direction regards white facing arrow mm digitreplaced urlreplaced seen camo color error log color mini map ? using poprocks high quality camos less problematic leave unit color determination old versions going camo causing issues custom camos not cause problems though im blue princess red entity image apply functionreplaced failed grab pixels camo image null player name bloodwolf facing zip urlreplaced pathreplaced,bug,bug,0,valid,https://github.com/MegaMek/megamek/issues/273,BLOODWOLF333,CONTRIBUTOR,3,"['BLOODWOLF333', 'BLOODWOLF333', 'arlith']","['Also, that MAD should have a green & black poprocks camo on it.....', 'You fixed this @alrith', ""This will be fixed by changes that are in PR #319.  The issue won't actually be fixed until that PR is merged in, so I'm going to leave it open until that happens.\n\nI have confirmed though that it wasn't related to #284.  It looks like when camo images are loaded, there was no mechanism to ensure that they were loaded before being used (aka, they weren't added to a `MediaTracker`.)""]","['CONTRIBUTOR', 'CONTRIBUTOR', 'CONTRIBUTOR']"
https://api.github.com/repos/eclipse/vorto,1809,open api generator generates invalid yml function blocks operation parameter,steps reproduce digitreplaced create information model using function block operations parameter digitreplaced generate open api yml digitreplaced open yml editor swagger io expected error actual generates request bodies content invalid according yml,bug,bug,0,valid,https://github.com/eclipse-vorto/vorto/issues/1809,aedelmann,CONTRIBUTOR,0,[],[],[]
https://api.github.com/repos/JHUAPL/AccumuloGraph,9,map reduce element incorrecly implements writable comparable wrong type,currently implementing writable comparable map reduce vertex implement writable comparable map reduce element,bug,bug,0,valid,https://github.com/JHUAPL/AccumuloGraph/issues/9,webbrl1,COLLABORATOR,0,[],[],[]
https://api.github.com/repos/spring-cloud/spring-cloud-netflix,673,enable oauth2sso work sprin clou security configure oauth digitreplaced client,using sprin clou starte parent version brixton digitreplaced test spring security oauth digitreplaced everything works fine enable eureka client enable eureka client reported error error failed execute goal org springframework boot sprin boo mave plugin digitreplaced digitreplaced digitreplaced release run defaul cli project sprin securit oauth digitreplaced brixto demo exception occured running null invocation target exception error creating bean name 'spring security filter chai defined class path resource pathreplaced security configuration class bean instantiation factory method failed nested exception org springframework beans bean instantiation exception failed instantiate javax servlet filter factory method 'spring security filter chai threw exception nested exception org springframework security config annotation built exception object built help digitreplaced maven pom xml codereplaced application java codereplaced resource server java codereplaced,bug,bug,0,valid,https://github.com/spring-cloud/spring-cloud-netflix/issues/673,zhangyongjiang,NONE,8,"['spencergibb', 'zhangyongjiang', 'dsyer', 'zhangyongjiang', 'dsyer', 'dsyer', 'zhangyongjiang', 'dsyer']","[""Please don't cross post: http://stackoverflow.com/questions/34003604/enableeurekaclient-cannot-work-with-enableoauth2sso-it-causes-springsecurityfil"", 'Sure. Which place do you prefer I post the question? And any idea about the issue I have? Thanks a lot.', 'I think if you have a `ResourceServerConfigurerAdapter` it needs to provide a request matcher, e.g. `http.antMatchers(""/**"")`.', '@dsyer I tried your suggestion. It doesn\'t work. Still report the same issue. ""Error creating bean with name \'springSecurityFilterChain\' defined in class path resource [org/springframework/security/config/annotation/web/configuration/WebSecurityConfiguration.class]: Bean instantiation via factory method failed; nested exception is org.springframework.beans.BeanInstantiationException: Failed to instantiate [javax.servlet.Filter]: Factory method \'springSecurityFilterChain\' threw exception; nested exception is org.springframework.security.config.annotation.AlreadyBuiltException: This object has already been built""\n\nI created a simple project at git@github.com:zhangyongjiang/spring-security-brixton.git . You may try it.\n\nYour help is highly appreciated.\n\nThanks.', ""Your app works if I remove the `spring-cloud-security` dependency. Not sure why you needed it anyway, but I'll see if I can make it fail more helpfully."", 'Including `spring-cloud-security` without configuring a `security.oauth2.client` blows up the SSO piece. (So you need that as well or else remove the `@EnableOAuth2Sso`.) I can make the error less obnoxious.', '@dsyer thank you.', 'Fixed here: https://github.com/spring-cloud/spring-cloud-security/commit/ee8b4cf339299a18cf95701673353d5e34c3eebb.']","['MEMBER', 'NONE', 'CONTRIBUTOR', 'NONE', 'CONTRIBUTOR', 'CONTRIBUTOR', 'NONE', 'CONTRIBUTOR']"
https://api.github.com/repos/wicketforge/wicketforge,146,exception latest digitreplaced eap,codereplaced original issue reported code google com codereplaced digitreplaced sep digitreplaced digitreplaced digitreplaced codereplaced,bug,bug,1,valid,https://github.com/wicketforge/wicketforge/issues/146,GoogleCodeExporter,NONE,0,[],[],[]
https://api.github.com/repos/stefan-niedermann/nextcloud-deck,169,remote deleted labels kept application,describe bug delete labels server synchronous unassigned not deleted reproduce steps reproduce behavior digitreplaced delete labels server digitreplaced synchronous application expected behavior deleted labels unassigned check not proposed,bug,bug,0,valid,https://github.com/stefan-niedermann/nextcloud-deck/issues/169,desperateCoder,COLLABORATOR,0,[],[],[]
https://api.github.com/repos/bentocorp/android,142,blank box displaying android signup clicking box clears email,cn34owduwaa2xyj urlreplaced,bug,bug,0,valid,https://github.com/bentocorp/android/issues/142,reg52,NONE,0,[],[],[]
https://api.github.com/repos/MarcusWolschon/osmeditor4android,648,lock icon disappears unsuccessful authentication,vespucci version vespucci digitreplaced digitreplaced digitreplaced digitreplaced device manufacturer model samsung galaxy digitreplaced a300fu android version digitreplaced digitreplaced digitreplaced pathreplaced recreate digitreplaced try upload data osm server authorization digitreplaced error occurs slow connection timeout authentication handshake retry application return main screen digitreplaced lock icon missing digitreplaced repeat icon appears try disappears expected behaviour lock icon disappears crash dump submitted yes date potentially relevant information language cs cz screenshot datereplaced digitreplaced digitreplaced digitreplaced urlreplaced screenshot datereplaced digitreplaced digitreplaced digitreplaced urlreplaced,defect,bug,1,valid,https://github.com/MarcusWolschon/osmeditor4android/issues/648,kudlav,NONE,3,"['simonpoole', 'kudlav', 'simonpoole']","['The workaround for now is ""then don\'t do that"" ... we\'ll have a look at it for the next release.', 'Persists in 10.0.2.', ""I haven't been able to repeat this in current builds, closing for now, if it does continue to turn up. Pls reopen.""]","['COLLABORATOR', 'NONE', 'COLLABORATOR']"
https://api.github.com/repos/inaturalist/iNaturalistAndroid,225,project chooser show observation fields users tons projects,like need verify fields actually downloaded application not not failed request ? cancelled request backgrounding ?,bug,bug,0,valid,https://github.com/inaturalist/iNaturalistAndroid/issues/225,kueda,MEMBER,2,"['budowski', 'kueda']","['There was a bug related to this that was fixed - that project observation fields were being overwritten if they had the same ID. Does it happen even if you made a clean re-install?', 'Should have been fixed by fffd7dd']","['CONTRIBUTOR', 'MEMBER']"
https://api.github.com/repos/lokka30/PhantomCombat,31,extra pathreplaced,pathreplaced target,bug,bug,0,valid,https://github.com/lokka30/PhantomCombat/issues/31,lokka30,OWNER,1,['lokka30'],['fixed in upcoming rel'],['OWNER']
https://api.github.com/repos/CyclopsMC/IntegratedDynamics,166,squeezer automation exploit resulted null pointer exception,cannot digitreplaced certain course seems machine built attempt fully automate squeezer resulted persistent crash time start game machine urlreplaced weird issue machine working first switches attempted automate using logic cables give much details possible crash happened immediately destroyed switch position able reproduce twice creative digitreplaced cases logic cables device like pipes urlreplaced logic cables present switch top stops working activate piston reason related upper switch state pipes added switch destroyed game crashes nay freezes crash pathreplaced latest server crash report urlreplaced pathreplaced pathreplaced datereplaced digitreplaced digitreplaced digitreplaced server txt latest log urlreplaced pathreplaced pathreplaced,bug,bug,0,valid,https://github.com/CyclopsMC/IntegratedDynamics/issues/166,JSideris,NONE,1,['JSideris'],"[""I was wondering if this was squeezer related or if it was something else. Again, I can't be sure, but this contraption doesn't experience the same issue:\r\n\r\n![No problems here](https://cloud.githubusercontent.com/assets/8083793/24763545/ab44d11c-1abf-11e7-844c-412b7a972422.png)""]",['NONE']
https://api.github.com/repos/mett29/ing-sw-2018-lambertucci-losavio-mancassola,9,print scores match ends,currently match reaches end nothing happens,bug,bug,1,valid,https://github.com/mett29/ing-sw-2018-lambertucci-losavio-mancassola/issues/9,asparagii,COLLABORATOR,0,[],[],[]
https://api.github.com/repos/1908-aug19-java/Project2-Samuel-Chris-Kyle-BackEnd,11,reconfigured properties file added custom configuration file,issue issuereplaced application not able read systems environment variables ec digitreplaced not set connection running application added custom configuration class reads environment variables removed lines attempted application properties file solution tested working windows environment needs tested ec digitreplaced,bug,bug,0,valid,https://github.com/1908-aug19-java/Project2-Samuel-Chris-Kyle-BackEnd/pull/11,watchdogoblivion,CONTRIBUTOR,0,[],[],[]
https://api.github.com/repos/Rajawali/Rajawali,993,inverted face culling,time trying rotate set look object according touch event master branch following code gives desired result face culling seems inverted touch screen first time surface created ? codereplaced wrong ? help codereplaced,bug,bug,1,valid,https://github.com/Rajawali/Rajawali/issues/993,chocomega,NONE,13,"['jwoolston', 'jwoolston', 'chocomega', 'jwoolston', 'chocomega', 'jwoolston', 'jwoolston', 'chocomega', 'jwoolston', 'AndrewJo', 'jwoolston', 'MasDennis', 'MasDennis']","['For starters you have a thread safety issue here. `onTouchEvent()` is called on the UI thread while `onDrawFrame()` is called by the GL thread. The issue is that you access `mTarget` in both methods and there is no thread safety handling involved. This can (and often will) cause unexpected and indeterminate results. You need to protect `mTarget` with a synchronization scheme.', 'As far as the face culling goes, if the above does not fix it (it would be an unrelated problem manifesting in odd ways) then there is a bug in the default GL state I have assigned to the library. There are other issues with this that I need to fix so please let me know if the issue isnt resolved by the thread safety and I will look into it.', 'Thank you for the fast reply ! \nSo I just added/changed the following code\n\n``` java\nprivate static final Object OBJ_LOCK = new Object();\n\n    @Override\n    public void onTouchEvent(MotionEvent event) {\n        super.onTouchEvent(event);\n\n        synchronized (OBJ_LOCK) {\n            mTarget.x =  ( event.getX()/getViewportWidth() ) * 2 - 1;\n            mTarget.y = -((event.getY()/getViewportHeight()) * 2 - 1);\n            mTarget.z = 1;\n        }\n    }\n\n    @Override\n    public void onDrawFrame(GL10 glUnused) {\n        super.onDrawFrame(glUnused);\n\n        synchronized (OBJ_LOCK) {\n            float distance = mTarget.distanceTo(mLookAt);\n            if( distance > 0.05f )\n            {\n                Vector3 step = Vector3.subtract(mTarget, mLookAt);\n                step.multiply( 0.3f);\n                mLookAt.add(step);\n\n                mObject.setLookAt(mLookAt);\n\n            }\n        }\n    }\n```\n\nUnfortunately the behavior is the same :/', 'ok then it is possible it is a bug. Is there anyway you can send a screenshot?', ""Sure ! (I replaced the cube by an OBJ model)\nOk :+1: \n![frontface](https://f.cloud.github.com/assets/5123957/882595/f8272630-f965-11e2-97ff-3bf7c4083d01.png)\n\nNot Ok :(\n![backface](https://f.cloud.github.com/assets/5123957/882594/f7d352b2-f965-11e2-98ea-41b1d0b8174a.png)\n\nFor information when the culling is inverted, If I go to the settings then just go back, the culling is correct again. \n(I forgot to mentioned, I'm trying to make a Live Wallpaper)"", ""Yea that is definitely a culling problem. I'll add it to my growing list of things to fix but I'll try and address it sooner rather than later, possibly after I finish my current task. Just to be clear its fine when you load, you touch the screen and it breaks, then if you go to settings and back its fine again?"", 'In the meantime, try setting the model to double sided and see if it alleviates the problem (it will also give me more info on the source of the problem).', ""Exactly, once the model is loaded it's fine, I touch the screen and it breaks, then if I go to settings and back its fine again.\n\nThe funny thing is it looks like the behavior is different depending on how long I wait before touching the screen:\nIf I touch the screen like 15sec after the model is loaded -> it's fine\nBetween 1 and 15 sec -> culling inverted\nLess than 1 sec (if I'm quick enough) -> black screen ! (and going to settings and back doesn't change anything)\n\nSetting the model to double sided alleviates the culling problem but not the black screen. I think I can live with that for now if the performance hit is not too high.\n\nI hope those informations will help you. Anyway thanks again for your support."", ""Thanks for the added info, I'll see what I can find."", 'Eh... I thought I fixed the culling problem. What version is this? 0.9?', ""Yea I may have jacked this up when I tried reducing go state changes though. I'm almost ready to get to looking at it. This is in master."", 'Hi @chocomega could you test this against the latest master? The lookAt code has changed, maybe this was fixed along the way :)', 'Closing this as stale. Please reopen if the problem persists.']","['MEMBER', 'MEMBER', 'NONE', 'MEMBER', 'NONE', 'MEMBER', 'MEMBER', 'NONE', 'MEMBER', 'MEMBER', 'MEMBER', 'MEMBER', 'MEMBER']"
https://api.github.com/repos/imixs/imixs-workflow,396,rule plugin update event not set new items,update event method rule plugin not update new items provided event object codereplaced codereplaced,bug,bug,0,valid,https://github.com/imixs/imixs-workflow/issues/396,rsoika,MEMBER,1,['rsoika'],['fixed'],['MEMBER']
https://api.github.com/repos/google/closure-compiler,3178,compiler crashes asynchronous function default argument compiling esnext es digitreplaced,sample code codereplaced crashes following error codereplaced,bug,bug,0,valid,https://github.com/google/closure-compiler/issues/3178,trxcllnt,NONE,5,"['brad4d', 'brad4d', 'brad4d', 'lkjames', 'brad4d']","['Created internal Google issue b/121377660', 'Thanks for pointing this out @trxcllnt', 'Internal tracking switched to issue http://b/122100368\r\nI understand the problem and am working on a fix', ""Any updates on this? I'm having the same problem."", 'This was fixed in https://github.com/google/closure-compiler/commit/83a8b02c384abda8db5b57d46c1805f592ccd77a#diff-8766342281b3b4b5ee20a57d7f5b061d\r\n\r\nI\'m not sure why this issue wasn\'t automatically closed by the ""Fixes"" comment on that commit.\r\n\r\nIf you are having a problem with the current version of closure-compiler, please file a new issue with instructions for reproducing the problem. Thanks.']","['CONTRIBUTOR', 'CONTRIBUTOR', 'CONTRIBUTOR', 'NONE', 'CONTRIBUTOR']"
